{
  "schema_version": 1,
  "kind": "format",
  "id": "quote-card",
  "production_owner": "growth-canva",
  "production_reference": "social/guides/canva.md",
  "channels": [
    "x",
    "threads",
    "instagram",
    "facebook"
  ],
  "guide": "social/guides/formats.md",
  "min_assets": 1,
  "max_assets": 1,
  "snackable": true,
  "delivery_checks": [
    "The quote on the card is a literal match to the published piece; paraphrase is never set in quote marks (engine/run/canva.py).",
    "Brand kit and an approved template only, sized for the selected channel.",
    "A derivative of an approved piece: it posts once the publish board is approved, after the batch preview through 2026-11-29 (invariants/authority.json).",
    "Share mechanic: one line from the published piece, quoted exactly, that a person forwards to a named colleague as the point of the piece, readable on the card alone; the share block names that colleague as its receiver.",
    "Before Krish sees it: a complete share block (social/share.json), no generic share call to action in the copy, and a blind send test whose reader names the declared receiver and job (crew/send-test).",
    "Bind publication approval to the exact account, caption, ordered asset hashes, metadata and proposed time.",
    "After a save, wait and independently reopen; reconcile uncertain outcomes before retrying."
  ],
  "measurements": [
    "Primary measure (Krish, 28 October 2026): sends, meaning native shares, per reach and saves per reach against the format's own channel median; a house hypothesis until MYMU's own dated data confirms it (lesson share-rate-measure).",
    "Dated exposed reach and meaningful engagement, preserving missing values.",
    "Relevant follower/profile movement and source-attributed publication subscriptions where exposed.",
    "24-hour, 72-hour and seven-day readback after actual publication; no financial ROI inference from draft counts."
  ],
  "lessons": [
    "revision-identity",
    "growth-measurement",
    "canva-lane-boundary",
    "built-to-be-sent",
    "share-rate-measure"
  ]
}
